{
  "record_id": "adopt-service-go",
  "preset_ref": "service-go-api",
  "applicability": "applicable",
  "binding_mode": "exact",
  "approval_policy": "human-approved",
  "resolution_status": "resolved",
  "responsible_owner": "repo-maintainers",
  "evidence": ["architecture decision"],
  "review_date": "2026-12-12",
  "parameters": {
    "deployment region": "us-east"
  }
}
